<?xml version="1.0" encoding="UTF-8"?>
<ds xmlns:xsi="http://www.w3.org/2001/XMLSchema-instance"
	xsi:noNamespaceSchemaLocation="http://www.osbitools.com/xsd/ds.xsd"
	descr="Test DataSet" enabled="true" ver_max="1" ver_min="0">

	<lang_map>
		<column name="COL1" />
		<column name="COL2" />
	</lang_map>

	<ex_columns>
		<auto_inc>
			<column name="A11" />
			<column name="B22" />
		</auto_inc>

		<calc>
			<column java_type="java.lang.Integer" name="CALC1">A + B</column>
			<column java_type="java.lang.String" name="CALC2">C + D</column>
		</calc>
	</ex_columns>

	<sort_by_grp>
		<sort_by idx="1" column="COL1" sequence="asc" unique="false" />
		<sort_by idx="2" column="COL2" sequence="desc" unique="false" />
	</sort_by_grp>

	<filter><![CDATA[A < B]]></filter>

	<group_data>
		<columns>
			<column name="COL1" java_type="java.lang.String" on_error="" />
			<column name="COL2" java_type="java.lang.String" on_error="" />
			<column name="A11" java_type="java.lang.Integer" on_error="" />
			<column name="B22" java_type="java.lang.Integer" on_error="" />
			<column name="CALC1" java_type="java.lang.Integer" on_error="" />
			<column name="CALC2" java_type="java.lang.String" on_error="" />
		</columns>
		<ds_list>
		  <!-- Group Item #1 -->
			<group_ds>
				<group_data>
					<ds_list>
					  <!-- Combine all 4 dataset types -->
					  
					  <!-- Group -->
						<group_ds>
							<sort_by_grp>
								<sort_by idx="1" column="COL1" />
							</sort_by_grp>
							<group_data>
								<ds_list>
									<static_ds>
										<static_data>
											<columns>
												<column name="COL1" java_type="java.lang.String"
													on_error="ERROR GRP 1-1-1 !!!" />
												<column name="COL2" java_type="java.lang.String"
													on_error="ERROR GRP 1-1-1 !!!" />
											</columns>
											<static_rows>
												<row>
													<cell name="COL1" value="UUu" />
													<cell name="COL2" value="ЦцЦ" />
												</row>
												<row>
													<cell name="COL1" value="dDd" />
													<cell name="COL2" value="ЗЗз" />
												</row>
											</static_rows>
										</static_data>
									</static_ds>

									<static_ds>
										<static_data>
											<columns>
												<column name="COL1" java_type="java.lang.String"
													on_error="ERROR GRP 1-1-2 !!!" />
												<column name="COL2" java_type="java.lang.String"
													on_error="ERROR GRP 1-1-2 !!!" />
											</columns>
											<static_rows>
												<row>
													<cell name="COL1" value="uuU" />
													<cell name="COL2" value="Ццц" />
												</row>
												<row>
													<cell name="COL1" value="Ddd" />
													<cell name="COL2" value="ЗЗз" />
												</row>
											</static_rows>
										</static_data>
									</static_ds>
								</ds_list>
							</group_data>
						</group_ds>
						
						<!-- Static -->
						<static_ds>
							<static_data>
								<columns>
									<column name="COL1" java_type="java.lang.String"
										                        on_error="ERROR GRP 1-2-1 !!!" />
									<column name="COL2" java_type="java.lang.String"
										                        on_error="ERROR GRP 1-2-1 !!!" />
								</columns>
								<static_rows>
									<row>
										<cell name="COL1" value="uUu" />
										<cell name="COL2" value="цЦц" />
									</row>
									<row>
										<cell name="COL1" value="Ddd" />
										<cell name="COL2" value="ЗзЗ" />
									</row>
								</static_rows>
							</static_data>
						</static_ds>

						<!-- Csv -->
						<csv_ds>
						  <csv_data file_name="filter_complex_no_header.csv" col_first_row="false">
				        <columns>
				            <column java_type="java.lang.String" name="COL1" on_error="" />
				            <column java_type="java.lang.String" name="COL2" on_error="" />
				        </columns>
              </csv_data>
						</csv_ds>
						
						<!-- Sql -->
						<sql_ds>
						  <sql_data>
                <sql>
                  <descr>Simple Select</descr>
                  <sql_text>SELECT * FROM TEST_DATA</sql_text>
                </sql>
              </sql_data>
						</sql_ds>
					</ds_list>
				</group_data>
			</group_ds>
			
			<!-- Group Item #2 -->
			<static_ds>
				<lang_map>
					<column name="COL1" />
					<column name="COL2" />
				</lang_map>

				<static_data>
					<columns>
						<column name="COL1" java_type="java.lang.String" 
						                                on_error="ERROR GRP 2 !!!" />
						<column name="COL2" java_type="java.lang.String" 
						                                      on_error="ERROR GRP 2 !!!" />
					</columns>
					<static_rows>
						<row>
							<cell name="COL1" value="bBb" />
							<cell name="COL2" value="УуУ" />
						</row>
						<row>
							<cell name="COL1" value="AaA" />
							<cell name="COL2" value="пПп" />
						</row>
					</static_rows>
				</static_data>
			</static_ds>
		</ds_list>
	</group_data>
</ds>
