<?xml version="1.0" encoding="UTF-8"?>
<ds xmlns:xsi="http://www.w3.org/2001/XMLSchema-instance"
	xsi:noNamespaceSchemaLocation="http://www.osbitools.com/xsd/ds.xsd"  ver_max="1" ver_min="0">
	
    <lang_map>
		<column name="COL1" />
	</lang_map>
	
    <ex_columns>
        <auto_inc>
            <column name="COL2" inc_by="5" start_from="-5"/>
            <column name="COL3"/>
        </auto_inc>
        
        <calc>
            <column java_type="java.lang.Integer" name="COL4">@{COL2} + 
                										@{COL3}</column>
            <column java_type="java.lang.Integer" name="COL5">@{COL2} + 
                	@{COL3} + @{COL2} * 2 + @{COL2}* @{COL3} + @{COL3} * 
                	@{COL3} </column>
            <column java_type="java.lang.Integer" name="COL6" 
                stop_on_error="false" error_value="-100">@{COL2}/@{COL3} </column>
            <column java_type="java.lang.Double" name="COL7">new Double(@{COL2})/new Double(@{COL3} + 1) </column>
            <column java_type="java.lang.String" name="COL8">@{COL1} + " " + 
                	@{COL1} + " " + @{COL2}*@{COL2}</column>
        </calc>
    </ex_columns>
    
	<static_data>
	    
		<columns>
			<column name="COL1" java_type="java.lang.String" on_error="" />
		</columns>

		<static_rows>
			<row>
				<cell name="COL1" value="LL_USERNAME" />
			</row>

			<row>
				<cell name="COL1" value="LL_PASSWORD" />
			</row>
			
			<row>
				<cell name="COL1" value="LL_LETS_GO" />
			</row>
		</static_rows>
	</static_data>
</ds>