<?xml version="1.0" encoding="UTF-8"?>
<ds xmlns:xsi="http://www.w3.org/2001/XMLSchema-instance"
	xsi:noNamespaceSchemaLocation="http://www.osbitools.com/xsd/ds.xsd"
	ver_max="1" ver_min="0">
	<group_data>
		<ds_list>
			<group_ds>
				<lang_map>
					<column name="COL1" />
				</lang_map>
				<ex_columns>
					<auto_inc>
						<column name="CNT" />
					</auto_inc>
				</ex_columns>
				<sort_by_grp>
					<sort_by idx="1" column="COL1" />
				</sort_by_grp>
				<group_data>
					<ds_list>
						<static_ds>
							<static_data>
								<columns>
									<column name="COL1" java_type="java.lang.String"
										on_error="" />
								</columns>
								<static_rows>
									<row>
										<cell name="COL1" value="LL_USERNAME" />
									</row>
									<row>
										<cell name="COL1" value="LL_PASSWORD" />
									</row>
								</static_rows>
							</static_data>
						</static_ds>

						<static_ds>
							<static_data>
								<columns>
									<column name="COL1" java_type="java.lang.String"
										on_error="" />
								</columns>
								<static_rows>
									<row>
										<cell name="COL1" value="LL_USERNAME" />
									</row>
									<row>
										<cell name="COL1" value="LL_PASSWORD" />
									</row>
								</static_rows>
							</static_data>
						</static_ds>

						<group_ds>
							<group_data>
								<ds_list>
									<static_ds>
										<static_data>
											<columns>
												<column name="COL1" java_type="java.lang.String"
													on_error="" />
											</columns>

											<static_rows>
												<row>
													<cell name="COL1" value="LL_USERNAME" />
												</row>
												<row>
													<cell name="COL1" value="LL_PASSWORD" />
												</row>
											</static_rows>
										</static_data>
									</static_ds>
								</ds_list>
							</group_data>
						</group_ds>
					</ds_list>
				</group_data>
			</group_ds>
		</ds_list>
	</group_data>
</ds>
